{
  "schema_version": "0.3.0",
  "document_type": "asset_register",
  "registry_id": "homestead.primary.v0_3",
  "generated_at": "2026-08-06T18:51:57Z",
  "site_id": "site.site.primary.01",
  "design_basis": {
    "authoritative_design_document": "Homestead_Digital_Twin_Software_Design_Document_v0.2.md",
    "design_stage": "pre-procurement_and_pre-site-deployment",
    "source_documents": [
      "Homestead_Digital_Twin_Software_Design_Document_v0.2.md",
      "Homestead Datacenter Rack and Power Infrastructure Overview(1).pdf",
      "Argivoltaic System Design(1).png",
      "35 Mwh-yr Solar and Battery Design(1).png"
    ],
    "open_design_conflicts": [
      {
        "conflict_id": "energy.capacity_revision",
        "current_working_target": "45 kWdc PV, four 10 kW hybrid inverters, 800 kWh nominal / 640 kWh usable battery",
        "predecessor_design": "26.4 kWdc PV, two 10 kW inverters, 240 kWh usable LiFePO4 battery",
        "treatment": "Preserved as unresolved. The v0.3 register uses the revised target for functional asset count but leaves chemistry, module count, topology, and procurement model unresolved."
      },
      {
        "conflict_id": "power_container.common_failure_domain",
        "current_plan": "Power conversion, battery, utilities, and primary rack share a 20-foot container.",
        "treatment": "Register includes a physically separate secondary control node as a required planned asset."
      }
    ]
  },
  "assets": [
    {
      "asset_id": "site.site.primary.01",
      "domain": "site",
      "asset_class": "site",
      "name": "Primary Homestead Site",
      "status": "concept",
      "criticality": "critical",
      "control_authority": "supervisory",
      "functional_position": true,
      "parent_id": null,
      "location": {},
      "properties": {
        "timezone": "America/Toronto",
        "site_address_status": "TBD",
        "boundary_status": "TBD",
        "design_phase": "pre_land_acquisition_or_pre_deployment"
      },
      "external_identifiers": [],
      "network": {},
      "power": {},
      "dependencies": [],
      "manual_override": {},
      "documentation": [],
      "maintenance_plan": {},
      "point_profile_refs": [
        "common_monitored"
      ],
      "source_refs": [
        {
          "document": "Homestead_Digital_Twin_Software_Design_Document_v0.2.md",
          "section": "3, 25-29"
        }
      ],
      "notes": [],
      "open_fields": [
        "property_coordinates",
        "survey_boundary",
        "jurisdiction",
        "final_climate_profile"
      ],
      "tags": []
    },
    {
      "asset_id": "site.geographic_zone.agrivoltaic_field.01",
      "domain": "site",
      "asset_class": "geographic_zone",
      "name": "Agrivoltaic Field",
      "status": "planned",
      "criticality": "important",
      "control_authority": "none",
      "functional_position": true,
      "parent_id": "site.site.primary.01",
      "location": {},
      "properties": {
        "land_use": "dual_use_solar_and_crop_production",
        "design_area_acres": 0.5,
        "area_basis": "conceptual",
        "row_count": 4,
        "crop_alley_count": 3
      },
      "external_identifiers": [],
      "network": {},
      "power": {},
      "dependencies": [],
      "manual_override": {},
      "documentation": [],
      "maintenance_plan": {},
      "point_profile_refs": [],
      "source_refs": [
        {
          "document": "Argivoltaic System Design(1).png",
          "section": "System summary and field diagram"
        }
      ],
      "notes": [],
      "open_fields": [
        "final_polygon",
        "slope",
        "drainage_geometry",
        "soil_profile",
        "service_lane_dimensions"
      ],
      "tags": []
    },
    {
      "asset_id": "site.geographic_zone.orchard.01",
      "domain": "site",
      "asset_class": "geographic_zone",
      "name": "Orchard and Food Forest Zone",
      "status": "planned",
      "criticality": "important",
      "control_authority": "none",
      "functional_position": true,
      "parent_id": "site.site.primary.01",
      "location": {},
      "properties": {
        "land_use": "orchard_food_forest",
        "geometry_status": "TBD"
      },
      "external_identifiers": [],
      "network": {},
      "power": {},
      "dependencies": [],
      "manual_override": {},
      "documentation": [],
      "maintenance_plan": {},
      "point_profile_refs": [],
      "source_refs": [
        {
          "document": "Homestead_Digital_Twin_Software_Design_Document_v0.2.md",
          "section": "3, 25-29"
        }
      ],
      "notes": [],
      "open_fields": [
        "final_polygon",
        "irrigation_subzones"
      ],
      "tags": []
    },
    {
      "asset_id": "structure.structure.power_container.01",
      "domain": "structure",
      "asset_class": "structure",
      "name": "Power, Utilities, Battery and Server Container",
      "status": "planned",
      "criticality": "critical",
      "control_authority": "none",
      "functional_position": true,
      "parent_id": "site.site.primary.01",
      "location": {},
      "properties": {
        "structure_type": "20_ft_shipping_container",
        "combined_failure_domain": true,
        "fire_zone_status": "TBD",
        "envelope_status": "TBD"
      },
      "external_identifiers": [],
      "network": {},
      "power": {},
      "dependencies": [],
      "manual_override": {},
      "documentation": [],
      "maintenance_plan": {},
      "point_profile_refs": [],
      "source_refs": [
        {
          "document": "Homestead_Digital_Twin_Software_Design_Document_v0.2.md",
          "section": "3, 25-29"
        },
        {
          "document": "Homestead Datacenter Rack and Power Infrastructure Overview(1).pdf",
          "section": "Core rack, network, power, VLAN, and NetBotz descriptions"
        }
      ],
      "notes": [
        "Combined battery, power-conversion, utilities, and server functions create a common-mode failure domain."
      ],
      "open_fields": [
        "exact_container_model",
        "insulation_system",
        "fire_separation",
        "ventilation_zones",
        "floor_loading",
        "egress",
        "secondary_control_node_location"
      ],
      "tags": []
    },
    {
      "asset_id": "structure.room.power_container.power_zone",
      "domain": "structure",
      "asset_class": "room",
      "name": "Power Conversion Zone",
      "status": "planned",
      "criticality": "critical",
      "control_authority": "none",
      "functional_position": true,
      "parent_id": "structure.structure.power_container.01",
      "location": {},
      "properties": {
        "environmental_class": "electrical_power_zone"
      },
      "external_identifiers": [],
      "network": {},
      "power": {},
      "dependencies": [],
      "manual_override": {},
      "documentation": [],
      "maintenance_plan": {},
      "point_profile_refs": [],
      "source_refs": [
        {
          "document": "Homestead_Digital_Twin_Software_Design_Document_v0.2.md",
          "section": "3, 25-29"
        }
      ],
      "notes": [],
      "open_fields": [
        "physical_partition",
        "cooling_setpoints"
      ],
      "tags": []
    },
    {
      "asset_id": "structure.room.power_container.battery_zone",
      "domain": "structure",
      "asset_class": "room",
      "name": "Battery Zone",
      "status": "planned",
      "criticality": "critical",
      "control_authority": "none",
      "functional_position": true,
      "parent_id": "structure.structure.power_container.01",
      "location": {},
      "properties": {
        "environmental_class": "battery_energy_storage_zone"
      },
      "external_identifiers": [],
      "network": {},
      "power": {},
      "dependencies": [],
      "manual_override": {},
      "documentation": [],
      "maintenance_plan": {},
      "point_profile_refs": [],
      "source_refs": [
        {
          "document": "Homestead_Digital_Twin_Software_Design_Document_v0.2.md",
          "section": "3, 25-29"
        }
      ],
      "notes": [],
      "open_fields": [
        "physical_partition",
        "ventilation",
        "temperature_limits",
        "chemistry_final"
      ],
      "tags": []
    },
    {
      "asset_id": "structure.room.power_container.server_zone",
      "domain": "structure",
      "asset_class": "room",
      "name": "Server and Network Zone",
      "status": "planned",
      "criticality": "critical",
      "control_authority": "none",
      "functional_position": true,
      "parent_id": "structure.structure.power_container.01",
      "location": {},
      "properties": {
        "environmental_class": "it_equipment_zone"
      },
      "external_identifiers": [],
      "network": {},
      "power": {},
      "dependencies": [],
      "manual_override": {},
      "documentation": [],
      "maintenance_plan": {},
      "point_profile_refs": [],
      "source_refs": [
        {
          "document": "Homestead_Digital_Twin_Software_Design_Document_v0.2.md",
          "section": "3, 25-29"
        },
        {
          "document": "Homestead Datacenter Rack and Power Infrastructure Overview(1).pdf",
          "section": "Core rack, network, power, VLAN, and NetBotz descriptions"
        }
      ],
      "notes": [],
      "open_fields": [
        "cooling_architecture",
        "airflow_partition",
        "target_temperature",
        "humidity_limits"
      ],
      "tags": []
    },
    {
      "asset_id": "energy.pv_array.agrivoltaic_field.01",
      "domain": "energy",
      "asset_class": "pv_array",
      "name": "Agrivoltaic PV Array",
      "status": "planned",
      "criticality": "critical",
      "control_authority": "vendor_native",
      "functional_position": true,
      "parent_id": "site.geographic_zone.agrivoltaic_field.01",
      "location": {